{
  "version": "1.0",
  "artifact_type": "gap_assessment",
  "artifact_id": "gap-specifying-mission-20260409-wMdPQ77D",
  "producer_type": "orchestration_authority",
  "scope_in_summary": "15 issues across 5 tracks compiled into 9 tasks",
  "scope_out_summary": "Korean docs, new protocol docs, new agent types",
  "fully_delivered": [
    "Mission spec frozen",
    "Design brief approved with vote round",
    "9 tasks compiled and approved"
  ],
  "partially_delivered": [],
  "not_delivered": [],
  "intentional_cuts": [],
  "unexpected_additions": [],
  "recommended_followups": [],
  "created_at": "2026-04-09T13:36:00Z"
}
