{
  "version": "1.0",
  "artifact_type": "gap_assessment",
  "artifact_id": "gap-polishing-mission-20260409-vHHWWURw",
  "producer_type": "orchestration_authority",
  "scope_in_summary": "No polishing needed for cleanup mission",
  "scope_out_summary": "N/A",
  "fully_delivered": [],
  "partially_delivered": [],
  "not_delivered": [],
  "intentional_cuts": [],
  "unexpected_additions": [],
  "recommended_followups": [],
  "created_at": "2026-04-09T13:16:00Z"
}
