{
  "version": "1.0",
  "artifact_type": "gap_assessment",
  "artifact_id": "gap-evolving-mission-20260409-vHHWWURw",
  "producer_type": "orchestration_authority",
  "scope_in_summary": "Legacy cleanup and release redefinition complete",
  "scope_out_summary": "Korean docs, new features, v1.0.0 release deferred",
  "fully_delivered": [
    "All 12 acceptance criteria met"
  ],
  "partially_delivered": [],
  "not_delivered": [],
  "intentional_cuts": [
    "Korean agent name sync (separate mission)"
  ],
  "unexpected_additions": [
    "Hybrid naming convention documented"
  ],
  "recommended_followups": [
    "Push tags to remote",
    "CLI usability improvements (5 issues logged)",
    "Korean docs sync"
  ],
  "created_at": "2026-04-09T13:18:00Z"
}
