{
  "version": "1.0",
  "artifact_type": "gap_assessment",
  "artifact_id": "gap-building-mission-20260409-vHHWWURw",
  "producer_type": "orchestration_authority",
  "scope_in_summary": "CLI bug fixes, stale reference cleanup, tag flattening, version updates, CHANGELOG creation",
  "scope_out_summary": "New features, v1.0.0 release, protocol content changes, Korean docs sync",
  "fully_delivered": [
    "CLI evolution.ts cwd bug fixed",
    "v3 no-op functions removed",
    "Stale fallbacks removed",
    "readInputData deduplicated",
    "pivot-protocol references fixed",
    "Hybrid naming convention documented",
    "Tags flattened to v0.x.y",
    "Versions updated to 0.5.1",
    "Protocol INDEX v1",
    "CHANGELOG.md created"
  ],
  "partially_delivered": [],
  "not_delivered": [],
  "intentional_cuts": [],
  "unexpected_additions": [],
  "recommended_followups": [
    "Push flattened tags to remote"
  ],
  "created_at": "2026-04-09T13:15:00Z"
}
