{
  "version": "1.0",
  "artifact_type": "gap_assessment",
  "artifact_id": "gap-mvp-001",
  "producer_type": "product_authority",
  "scope_in_summary": "MVP 범위: 로그인, 회원가입, 비밀번호 재설정 플로우 전체 구현. 인증 토큰 관리 및 세션 유지 포함.",
  "scope_out_summary": "로그인과 회원가입은 완전히 출시됨. 비밀번호 재설정은 UI만 구현되었고 이메일 토큰 백엔드는 미완료. 세션 복원 경로는 부분 구현.",
  "fully_delivered": [
    "로그인 폼 및 인증 플로우 (이메일/비밀번호)",
    "회원가입 폼 및 유효성 검증",
    "JWT 토큰 발급 및 저장",
    "로그아웃 기능"
  ],
  "partially_delivered": [
    "비밀번호 재설정 — UI 완료, 백엔드 토큰 플로우 미완료",
    "세션 복원 — 기본 경로만 구현, 만료 토큰 처리 미흡"
  ],
  "not_delivered": [
    "비밀번호 재설정 이메일 토큰 발급/검증 백엔드",
    "토큰 갱신(refresh) 만료 시 재인증 유도 플로우"
  ],
  "intentional_cuts": [
    "소셜 로그인 (OAuth) — evolution 단계로 연기",
    "다중 기기 세션 관리 — 범위 외 확정"
  ],
  "unexpected_additions": [
    "remember me 체크박스 — 이해관계자 요청으로 급거 추가",
    "로그인 실패 시 남은 시도 횟수 표시 UI"
  ],
  "recommended_followups": [
    "비밀번호 재설정 토큰 백엔드 태스크 생성 (polish 단계)",
    "토큰 갱신 만료 E2E 테스트 추가 — debt-101 참조",
    "세션 복원 경로 전체 커버리지 확보"
  ],
  "created_at": "2026-04-01T18:00:00Z"
}